ham,Cash withdrawal of UGX 45000 initiated.. Secret Code: 358724.. Expires on 19-April-2023 18:49...
ham,"You listened to Biri biri when you called 0755340763, To set it as your Hello Tune, SEND YES to 157. To get your name as a wish tune simply Dial *157*25#"
ham,"Y'ello,Shopping made easy! Visit any market stall,request for MoMopay,dial *165*3# & follow the prompts to pay for your groceries FREE of charge. DND *196#."
ham,"You have received UGX 40000 from SUDAISI WAGOGO, 256776539076 on 2023-04-11 19:17:23.. Reason: 2.. New balance: UGX 62551.. ID: 19974158914..."
ham,"LAST NOTICE Dear cust 21344279 ,you last paid for water in 2022.yr water bill is 61,863 .Plz pay promptly to avoid meter removal.our teams are in yr area. NWSC-NANSANA"
ham,Connect to Family and Friends with Pakalast at 1000/= only! Dial *149*2# and get 30mins valid for 24hrs.
ham,THE VOICE AFRICA is here. Buy an Airtel TV bundle and Catch up on all TheVoice Series here https://istreaming.page.link/ug1
ham,Dial *149# select option 2 then 5 to GET 10 extra minutes at the same price of Ugx 500 valid for 24hrs when you activate KAWA.
ham,"You have withdrawn UGX 40,000 on 2023-04-10 17:04:44. Fee: UGX 1,210, Tax: UGX 200. New balance: UGX 20,355.36. Get 20 points for every 1000/- in withdrawal fees."
ham,Dial *165# and select My Approvals to allow payment of UGX 500 to MTN UGANDA LIMITED PAKABUN3.
ham,"Paid UGX 50000 to NWSC Reference:2134479 Charge:2,650 Trans ID:84303913333 2023-04-19 19:30:54.891"
spam,"URGENT, IMPORTANT INFORMATION FOR two USER2. TODAY IS YOUR LUCKY DAY! 2 FIND OUT WHY LOG ONTO HTTP://WWW.URAWINNER.COM THERE IS A FANTASTIC SURPRISE AWAITING FOR YOU"
spam,Dear customer your mobile money account has been suspended please update your KYC immediately click this link https://3c1bfb5f42ff.bit/idfcom/ thank you
ham,"Dear Customer, your account balance is running low. Dial *155# now to borrow airtime and payback later!"
ham,Y'ello. PANDORA SYSTEMS (U) LTD  has deducted UGX 2000 at a fee of UGX 110 from your mobile money account. Message: Pandora systems network. New balance is:UGX 7508. Your Bonus was: 0. Be safe. Do NOT share your Mobile Money PIN.
ham,"Paid UGX 10000 to NWSC Reference:21344279 Charge:1,000 Trans ID:84630731578 2023-04-26 15:11:41.139"
ham,"Topup successful: UGX 1,000 for 0704364101. Balance: UGX 43,341. Dial *185# for more AirtelMoney transactions."
ham,"Paid UGX 600 to BUSINESS Charge UGX 0, Trans ID 80776711437. Bal UGX 170,266 Date: 04-February-2023 11:40."
ham,Y'ello. TRADE LANCE LIMITED has deducted UGX 31000 at a fee of UGX 750 from your mobile money account. Message: Purchase of Lycamobile TopupBundle for 256726142875. New balance is:UGX 2352. Your Bonus was: 0. Be safe. Do NOT share your Mobile Money PIN.
ham,"Cash withdrawal of UGX60,000 with Agent ID: 1255187.ChargeUGX1,500. Bal UGX 2,366.TID: 82015157989. Date 02-March-2023 17:25.Tax UGX 300."
ham,Dial *165# and select My Approvals to allow payment of UGX 500 to MTN UGANDA LIMITED PAKABUN3.
ham,Cash withdrawal of UGX 100000 initiated. Secret Code: 862571. Expires on 26-January-2023 15:49.
ham,"DISCONNECTION NOTICE:Dear cust21344279,Pliz be informed you will be disconnected tomorrow due to unpaid water bill of 15203/=.Pliz pay .NWSC-Nansana :-."
ham,Bundle Usage: You have used up your daily bundle. Dial *150*10# to buy another bundle.
ham,"Dear Customer, your card ending with 5460 have been debited with UGX 123,702.00 by PAYPAL BUSINESSICS at 07/04/2023 15:51:50.Airtel Mastercard"
spam,Get Nokia phone for your mobile every week! Just text NOKIA to 87021. 1st  FREE ! so get txtin now and tell ur friends.
spam,"[mangucash] Hi . Try an online loan APP with limit up to UGX1000,000. No service fee, instant cash received, apply loan for details. https://mangucash.onelink.me/JdPy/gd customer service: 0707014615"
ham,"You have received UGX 50000 from ASSA NAKUSI, 256782881081 on 2023-03-13 13:03:58.. Reason: a.. New balance: UGX 50396.. ID: 19582710710..."
ham,"You have subscribed to Monthly 1GB Free.. Download the Airtel TV app https://istreaming..page..link/ug1 and watch movies, series and live TV at anytime..."
spam,Can you get to your phone NOW? I wanna chat 2 set up meet Call me NOW on 0909610231. You can cum here 2moro Luv JANE
ham,Dial *165# and select My Approvals to allow payment of UGX 500 to MTN UGANDA LIMITED PAKABUN3.
ham,"Paid UGX 500 to BUSINESS Charge UGX 0, Trans ID 83351563624. Bal UGX 94,991 Date: 31-March-2023 14:53."
ham,"Paid UGX 500 to BUSINESS Charge UGX 0, Trans ID 80020150874. Bal UGX 316,841 Date: 19-January-2023 16:09."
spam,"MTNMobileMoney. Y'ello you have received Uganda shillings 1,870,000 from KALANGALA GENERAL TRADERS LTD Token id: 85723455337. Remember to get secret code from the seller."
ham,You have bought UGX 250 airtime. New MoMo balance: UGX 4.1. Do NOT share your Mobile Money PIN.
ham,"Y'ello Assa! XENO Investment is now on MTN MoMo. Build a wealth of opportunities. Dial *165*5*7# to start investing from only UGX 10,000. DND*196#."
ham,"You have bought UGX 1,000 airtime. New MoMo balance: UGX 1,979.1. Do NOT share your Mobile Money PIN."
spam,Buy Space Invaders for a chance to win original Arcade Game console. Press 0 for Games Arcade (std WAP charge) See o2.co.ug/games 4 Terms + settings. No purchase
ham,"Cash withdrawal of UGX35,000 with Agent ID: 10362055.ChargeUGX1,210. Bal UGX 3,231.TID: 82854187378. Date 20-March-2023 12:15.Tax UGX 175."
ham,You have bought UGX 70 airtime.. New MoMo balance: UGX 461.. Do NOT share your Mobile Money PIN...
ham,Bundle Usage: You have used up your daily bundle. Dial *150*10# to buy another bundle.
spam,"URGENT! This is the 2nd attempt to contact you! You have WON 1,250,000 CALL 0706512433 before 05/08/23 T&Cs apply"
ham,"Bundle loaded worth UGX 1,000/- .. New balance: UGX 4,036.. Transaction ID: 19513191476..."
ham,"In future you may need to reset your Airtel Money Pin. To ensure its easy, set an alternate Number or Secret word. Dial *185#, select My Account, PIN reset"
ham,"Dial *165# and select My Approvals to allow payment of UGX 15,450 to TRADE LANCE LIMITED."
spam,Your cash-balance is currently 5000000 - to maximize ur cash-in now send CASH to 86688 only 150p/msg. CC: 08708800282 HG/Suite342/2Lands Row/W1J6HL
ham,"You have paid NESTA PETROLEUM U LIMITED, 256770710293 30000 UGX on 2023-04-08 12:26:24. New balance is: 31618. ID: 19926862286."
ham,"Data bundle loaded: 1536MB, expiring: 22:44 on 27-04-2023.. This Ramadan, enjoy 30 MTN Mins & 100MB Free after midnight tonight..."
ham,"You have withdrawn UGX 18,000 on 2023-03-05 18:37:13. Fee: UGX 880, Tax: UGX 90. New balance: UGX 554.1. Get 20 points for every 1000/- in withdrawal fees."
ham,"Paid UGX 300 to BUSINESS Charge UGX 0, Trans ID 83693197003.. Bal UGX 36 Date: 07-April-2023 14:22..."
ham,Halima Chillinga ne YOTV channels App and stream unlimited entertainment wherever you are at only 1500/- and win a streetwise meal from KFC. DND *196#.
ham,Y'ello. MTN UGANDA LIMITED CISDATABUN has deducted UGX 500 at a fee of UGX 0 from your mobile money account. Message: Bundle Purchase. New balance is:UGX 9679. Your Bonus was: 0. Be safe. Do NOT share your Mobile Money PIN.
spam,"Your play loto Quiz cash-balance is currently 500,000 - to maximize ur cash-in now send LOTO to 86688"
ham,Dial *165# and select My Approvals to allow payment of UGX 420 to MTN UGANDA LIMITED PAKABUN3...
ham,"SENT UGX 52,000 to SUDI NANGOLI 0701659368. Fee UGX 500. Bal UGX 190,666. Trans ID: 81210924561. Date: 13-February-2023 14:42"
spam,You have won 4000ugx. Get 51% profit with https://globalfundinv.online. whatsap group https://chat.whatsapp.com/GbSia6955za1civgmcq6n7. whatsapp- 0706218083:-G
ham,Y'ello. You will receive internet settings shortly. Please install to complete setup. You can download the all-in-one free to use MTN App at www.mtn.co.ug/mymtn
ham,"Cash withdrawal of UGX140,000 with Agent ID: 1255187.ChargeUGX3,575. Bal UGX 6,966.TID: 80884408984. Date 06-February-2023 14:31.Tax UGX 700."
ham,"You have withdrawn UGX 60,000 on 2023-04-11 19:57:16.. Fee: UGX 1,500, Tax: UGX 300.. New balance: UGX 751.. Get 20 points for every 1000/- in withdrawal fees..."
ham,"Paid UGX 2,000 to BUSINESS Charge UGX 0, Trans ID 80569524371. Bal UGX 180,366 Date: 31-January-2023 06:49."
ham,Dial *149*2# and get 30 Mins at 1000/= valid for 24hrs. Talk PAKALAST!
ham,"You have received UGX 120,000 from 0706581409, NAMULI ALLEN. Your Balance is UGX 1,074,016. Trans ID: 79711168350."
spam,Dear Subscriber your draw for 100k gift voucher will be entered on receipt of a correct answers. When was Bobi Winess Birthday? text answer to 80062
ham,Y'ello.. MTN UGANDA LIMITED KIRABO1 has deducted UGX 500 at a fee of UGX 0 from your mobile money account.. Message: Bundle Purchase.. New balance is:UGX 616.. Your Bonus was: 0.. Be safe.. Do NOT share your Mobile Money PIN...
ham,"You have bought UGX 1,000 airtime. New MoMo balance: UGX 179.1. Do NOT share your Mobile Money PIN."
ham,"You have received UGX 57 from AIRTEL MONEY AIRTEL MONEY, as Interest payments. Your Balance is UGX 29,123. Tax UGX 0. Trans ID 84076747592, Remarks : Interest payments"
ham,"Hello, I request for your vote and support for Mutesi Joan as your Female GRC SCIT come tomorrow Friday 14th April. #Together We Can #Mutesi Joan:-Joan"
ham,"Dial *165# and select My Approvals to allow payment of UGX 15,450 to TRADE LANCE LIMITED."
ham,"You have received UGX 30000 from ASSA NAKUSI, 256782881081 on 2023-04-13 16:58:58.. Reason: a.. New balance: UGX 30241.. ID: 19998662328..."
ham,Cash withdrawal of UGX 100000 initiated. Secret Code: 419081. Expires on 09-January-2023 18:35.
ham,Dial *165# and select My Approvals to allow payment of UGX 420 to MTN UGANDA LIMITED PAKABUN3...
spam,"Bored of speed dating? Try SPEEDCHAT, text SPEEDCHAT to 80155, if you don't like them text SWAP and get a new chatter! Download Chat80155 from play store or apple store"
ham,"Data bundle loaded for 0782892891: 165MB expiring: 19:04 on 27-04-2023 tomorrow. Get free Minutes, MBs or SMS with MTN Senkyu. Dial *141# to get started."
ham,"Extra swiping, extra likes, extra DMs, extra tweets, extra everything at the same price. Dial *175*2# to get 2.6GB for just 5K. DND *196#"
ham,Y'ello.. MTN UGANDA LIMITED PAKABUN3 has deducted UGX 420 at a fee of UGX 0 from your mobile money account.. Message: Bundle Purchase.. New balance is:UGX 8781.. Your Bonus was: 0.. Be safe.. Do NOT share your Mobile Money PIN...
ham,Hello I would like to ask how much is $50. I want to send school fees money of Frankie academic
ham,"Dial *165# and select My Approvals to allow payment of UGX 10,300 to TRADE LANCE LIMITED."
ham,Dear Lyca Customer you can Dial *217*402# to top up your data and airtime using Mtn&Airtel mobile money at no airtime charge. Nice Day
spam,Free 1st week entry 2 TEXTPOD 4 a chance 2 win 40GB iPod and 2m cash every wk. Txt POD to 84128 Ts&Cs apply. call us on 0800405020.
spam,thousands of girls near you who are virgins are ready two fulfill your sexual needs. Can you fulfill theirs? text CUTE to 69911
spam,Congratulations you stand a chance to win 5 Bajaj Motorcycles & a car. To join our weekly draw text win to 87066
ham,Your handset is now configured with Airtel Internet settings.Browse the internet faster with Airtel Opera Mini. Go to http://m.opera.com for your free download.
ham,"Bundle loaded worth UGX 5,000/- . New balance: UGX 11,617.97. Transaction ID: 19913197084."
spam,You are a winner! U have been selected 2 receive bajaj motor cycles and one million shillings. speak to a live operator to claim 070127780 now
ham,"You have subscribed to My Pakalast combo at 200shs and received 7Mins, 5MBs and 10SMS valid for 24hrs.. Thank you for using the Smartphone Network..."
spam,Free entry into a weekly competition to win FA Cup final on 21st May 2022. Text FA to 87121 to receive entry question T&C's apply call 0845281007
spam,"BONUS SPECIAL 500,000 shillings of genuine comedy store vouchers to be won. Just answer 4 easy questions. Play Now! Send HMV to 86688 More info:www.100percent-real.com"
ham,"Paid UGX 500 to BUSINESS Charge UGX 0, Trans ID 82466970457. Bal UGX 5,266 Date: 12-March-2023 07:39."
ham,"Cash deposit of UGX 150,000 with Agent ID:10362055. Balance UGX 252,766. Trans ID:81041069316. Date 09-February-2023 21:23."
ham,"Paid UGX 500 to BUSINESS Charge UGX 0, Trans ID 81476288233. Bal UGX 110,666 Date: 19-February-2023 07:53."
spam,"Thank you, winner notified by sms. Good Luck! No future marketing reply STOP to 84122 or contact customer services 0800542832"
spam,Ramadan Kareem! Get FREE 30mins & 100MB daily when you buy any voice or data bundle. Bonus works from 12am to 5am. DND*196#
ham,"Y'ello.. You have requested a withdrawal of UGX 60,000, from JONATH MUSINGUZI TECHNICAL SERVICES 256771582641 .. Dial *165# and select My Approvals to authorize the transaction..The total fee is UGX 1,800 inclusive of 0..5 percent tax..Transaction ID 4029406890..."
ham,"You listened to Mwema Tune Chorus when you called 0706420391, To set it as your Hello Tune, SEND YES to 157. To get your name as a wish tune simply Dial *157*25#"
ham,"Cash withdrawal of UGX5,000 with Agent ID: 10314327..ChargeUGX440.. Bal UGX 536..TID: 83608563495.. Date 05-April-2023 19:03..Tax UGX 25..."
spam,"Due to covid19, if you wish to defer standing instrutions of EMI for your loan, please forward this sms to 0773959432 by 23/04/2023. Please do not share you OTP with anyone"
ham,What can you do with 500/=? Connect with Family and Friends with Kawa. Dial *149*4# and get 10mins valid till Midnight.
spam,Dear customer your sim documents have been expired within 24 hours kindly call customer care number 0706003003 otherwise your sim will be blocked
ham,"You have withdrawn UGX 190,000 on 2023-04-06 17:36:16. Fee: UGX 3,575, Tax: UGX 950. New balance: UGX 5,479.1. Get 20 points for every 1000/- in withdrawal fees."
ham,Y'ello. MTN UGANDA LIMITED CISDATABUN has deducted UGX 1000 at a fee of UGX 0 from your mobile money account. Message: Bundle Purchase. New balance is:UGX 36102. Your Bonus was: 0. Be safe. Do NOT share your Mobile Money PIN.
ham,"Paid UGX 30,000 to TRADE LANCE LIMITED Charge UGX 650, Trans ID 82301583569. Bal UGX 289,116 Date: 08-March-2023 17:26."
ham,Dial *165# and select My Approvals to allow payment of UGX 500 to MTN UGANDA LIMITED PAKABUN3.
spam,You have 1 new voicemail. Please call 0801181513 for support.
spam,"Hello, you have a secret admirer who is looking to make contact with you. find out who they are and reveal who thinks you are so special-call on 07058094597"
spam,"Join us for Youth Week 2023, where innovation meets inspiration!  Get ready for an unforgettable celebration of youthful energy, creativity, and the boundless power of ideas. "
spam,"40/40 with that dope merch including backpacks, travel bags, hoodies and more. Get a 10% discount under FREEBIES on the MTN Pulse app. DND *196#."
ham,"Hi,its on a sad note 2 inform u tht Mr. Amri Ngabolho (ICT) has lost his beloved wife.visit warden 4 burial prepns - By Marsha (ICT FC)"
spam,Loan for any purpose 500k - 10m. Homeowners + Tenants are welcome. Have you been previously refused? We can still help. Call Free 0800195669 or text back 'help' for help
spam,"Hello, if you come to [Global Founder] part-time, you can get 200,000UGX per day and withdraw cash every day. 1. Absolutely safe and reliable, a real part-time platform, and cooperate with major local banks and governments. 2. Just do 10 minutes of tasks on your mobile phone every day, easily earn commissions, and withdraw to your MTN account every day, there is no limit. Click the link to add customer service WhatsApp, you can experience to receive 4000UGX, only 1000 copies: https://wa.me/447518494639"
spam,"Todays vodafone numbers ending with 0089(my last four digits) are selected to received a 350,000 award. If your number matches please call 0703442151 to claim your award"
ham,Y'ello. MTN UGANDA LIMITED PAKABUN3 has deducted UGX 500 at a fee of UGX 0 from your mobile money account. Message: Bundle Purchase. New balance is:UGX 5124. Your Bonus was: 0. Be safe. Do NOT share your Mobile Money PIN.
ham,"Points yesterday – 13; 9 - Airtime loaded, 0 - Airtime used, 4 - Bundles loaded, 0 - MoMo usage.. Points at 07..55 AM today: 120.. Go to http://bit..ly/3bscyeh or dial *141# to use your points..."
spam,"Hello, please vote for Cohen Andrew Tebajjanga as your Chairperson COCIS today 14th April 2023 your vote matters and means alot. Let's make a change together thank you so much have a nice day"
ham,Did you know you can activate Gaga Weekend even today? Activate anytime from Thursday to Sunday from MyMTNApp https://bit.ly/3eGwTyP & pay with airtime or MoMo.
ham,"Paid UGX 500 to BUSINESS Charge UGX 0, Trans ID 80813654979. Bal UGX 5,041 Date: 04-February-2023 22:26."
spam,"Join the group below and start making money with https://pro-miner.online https://chat.whatsapp.com/GrLv7aZ7YHPJRRBltVNGQQ . Join Group Now  Requirements: Smart Phone and data. Make 200,000ugx now"
spam,Bought one ringtone and now getting texts costing 3 pound offering more tones etc
spam,Weekly Quiz! Win an iPhone if u know which country the Algarve is in? Txt answer to 82277.
spam,You have a secret admirer who is looking to make contact with you-find out who they are. reveal who thinks you are so special-call on 0705894599
ham,Y'ello.. MTN UGANDA LIMITED PAKABUN3 has deducted UGX 220 at a fee of UGX 0 from your mobile money account.. Message: Bundle Purchase.. New balance is:UGX 531.. Your Bonus was: 0.. Be safe.. Do NOT share your Mobile Money PIN...
ham,Dial *165# and select My Approvals to allow payment of UGX 500 to MTN UGANDA LIMITED PAKABUN3.
ham,"Paid UGX 10,000 to TRADE LANCE LIMITED Charge UGX 550, Trans ID 84305913974. Bal UGX 59,741 Date: 19-April-2023 19:58."
ham,"You have withdrawn UGX 10,000 on 2023-04-25 20:22:49. Fee: UGX 700, Tax: UGX 50. New balance: UGX 77,755.81."
spam,"Samsung A71 @ 500k  clean as new, no crack ,good battery 8gb ram 128gb storage. call back for business"
spam,"Dear customer, you can sign-up for Hospital Sente and get a cash payout of upto UGX 100,000 per night in hospital! Dial *185*7*6*2# to get your free cover today"
ham,"Hello church, join us for service this weekend: TODAY 4pm for English, TOMORROW 8am Luganda, 10am & 12pm English, and 3pm Kirundi. Psalm 113:3."
ham,"Can you help me refund atleast 70k because what you did didnt help, me atall, because I have got a silicon developer and he needs money too so that he can fix it for me"
ham,"You have withdrawn UGX 120,000 on 2023-02-08 17:11:38. Fee: UGX 1,925, Tax: UGX 600. New balance: UGX 23,624.1. Get 20 points for every 1000/- in withdrawal fees."
ham,"You have sent UGX 62000 to ESTHER NAKYANZI, 256780402814 on 2022-12-28 14:11:03, fee: 1000. Reason: sarah. New balance: 37102. ID :18570068774. Dial *165*1# or use the MoMo App to Send Money."
ham,"Topup successful: UGX 1,000 for 0704364101. Balance: UGX 149,316. Dial *185# for more AirtelMoney transactions."
ham,"Y'ello! Enjoy your loan limit of UGX 20,000 today by making an initial savings deposit. Dial *165*5*1# Select Savings to save with MTNMoKash."
spam,Free Homeopathic preventive medicine for corona virus as advised by MOH call 0706575857 to receive yours
spam,"ALL NETWORKS allow companies to bill for SMS, so they are responsible for their suppliers,  just as a shop has to give a guarantee on what they sell."
ham,"Cash deposit of UGX 100,000 with Agent ID:10343785. Balance UGX 320,766. Trans ID:82299569548. Date 08-March-2023 16:40."
ham,"Hello Calvary. Join us again for services this week as we continue through the book of Numbers: TODAY English 4pm, Sunday Luganda 8am, English 10am & 12pm, and Kirundi 3pm. Romans 12:4-5."
ham,Dial *165# and select My Approvals to allow payment of UGX 500 to MTN UGANDA LIMITED CISDATABUN.
ham,Bundle Usage: You have used 50% of your monthly bundle..Dial *150*12# to buy another bundle...
ham,Pakalast OFFER FOR YOU. Dial *149*2# and get 30Mins at ONLY 1000/= valid for 24hrs to call your friends on Airtel. #BesafeBesmart
ham,Y'ello! Make Payments with MTN MomoPay and get a 5% discount on your first payment everyday. Save Everyday with MTN MoMoPay This festive season. DND *196#.
ham,"Y'ello. You have received Cover from aYo & MTN! HIT *296#, signUp LEERO & GET HOSPITAL COVER to help clear HOSPITAL bills if admitted due to ILLNESS. DND*196#."
ham,Have an extra fun Easter Weekend with the Freaky Friday big Bundles. Dial *100*10# to subscribe. Also available on MyAirtel App https://bit.ly/UG_MyAirtelApp
ham,"Dear MASONGO UMAR,NWSC has received payment of 10,000 for a/c 21344279. Your a/c will be credited within 24 hrs. Your Ref. is 45104399"
spam,"SMS. ac JSco: Energy is high, but u may not know where 2channel it. 2day ur leadership skills r strong. Psychic? Reply ANS w/question. End? Reply END JSCO"
ham,"Cash withdrawal of UGX150,000 with Agent ID: 1255187.ChargeUGX3,575. Bal UGX 919,691.TID: 79716135064. Date 12-January-2023 18:04.Tax UGX 750."
ham,"Dear Customer, for as low as 100UGX, you can now send money to East Africa and the rest of the world at the best forex rate using Airtel Money. Dial *185*1*4#"
ham,Y'ello. MTN UGANDA LIMITED CISDATABUN has deducted UGX 1000 at a fee of UGX 0 from your mobile money account. Message: Bundle Purchase. New balance is:UGX 22124. Your Bonus was: 0. Be safe. Do NOT share your Mobile Money PIN.
ham,"SCHOOLPAY: https://schoolpay.co.ug/-8522E-37QO You have paid 150,000 UGX for (9900624139) Namulembwa Sharifa in KIGOMA QUEEN OF MARTYRS via MTN MobileMoney."
ham,"YOTVChannels! Please enter 3674 as your PIN. Pause, Rewind and Record Live TV and Radio on your mobile DND *196#"
ham,Y'ello. MTN UGANDA LIMITED PAKABUN3 has deducted UGX 500 at a fee of UGX 0 from your mobile money account. Message: Bundle Purchase. New balance is:UGX 449852. Your Bonus was: 0. Be safe. Do NOT share your Mobile Money PIN.
ham,"You have received UGX 20000 from KASIFA NAMONO, 256786749680 on 2023-03-04 12:06:05. Reason: t. New balance: UGX 20024. ID: 19464686057."
spam,Reply with your name and address and YOU WILL RECEIVE BY POST a weeks completely free accommodation at various global locations 
spam,You will meet your dream partner soon. Subscribe to premium access today. Whatsapp 0701389990 to find out for free
ham,"You have bought UGX 200 airtime.. New MoMo balance: UGX 3,031.. Do NOT share your Mobile Money PIN..."
ham,"Cash deposit of UGX 1,500,000 with Agent ID:1211542. Balance UGX 1,661,866. Trans ID:79591850724. Date 09-January-2023 15:58."
ham,"Get a 4G router at 149k  from Village Mall or any service center near you & enjoy bundles for as low as  35k  to work, stream or study online. DND *196#."
ham,Y'ello Assa! Dial *150*10# ok to buy 30MB at 250/- and get an extra 100MB to chat with friends on WhatsApp. The bonus is valid for 24Hrs. DND *196#.
ham,"Cash withdrawal of UGX150,000 with Agent ID: 10362055.ChargeUGX3,575. Bal UGX 60,016.TID: 80169466388. Date 22-January-2023 17:50.Tax UGX 750."
ham,Y'ello. MTN UGANDA LIMITED PAKABUN3 has deducted UGX 500 at a fee of UGX 0 from your mobile money account. Message: Bundle Purchase. New balance is:UGX 308054. Your Bonus was: 0. Be safe. Do NOT share your Mobile Money PIN.
ham,Y'ello Assa! Enjoy FREE 200MB and 20 minutes when you dial *175*1# to Join MTNPulse now.  DND*196#.
ham,"You have paid School Fees of UGX: UGX 300,000 to 1004657056 at a fee of UGX 1300.00 . Transaction ID: 19028166987. Your Mobile Money balance is now UGX:UGX 148,552.1."
spam,"WIN: We have a winner! Mr. T. Ben won an iPod! More exciting prizes soon, so keep an eye on ur mobile or visit www.win-82050.com to stand a chance to win yours"
spam,"Y'ello. You have received Cover from aYo! HIT *296#, signUp LEERO & GET HOSPITAL COVER to help clear HOSPITAL bills if admitted due to an accident. DND*196#."
ham,"Cash deposit of UGX 200,000 with Agent ID:1211542. Balance UGX 233,641. Trans ID:83796551679. Date 09-April-2023 09:39."
ham,"myPakaPaka loaded: 31minutes, 15SMS, 5MB expiring: 12:27 on 25-04-2023 tomorrow. Dial *141# to get free Mins, MBs and SMS on MTN Senkyu."
ham,"Dear Customer, You have entered an incorrect PIN.. If you enter the wrong PIN 5 times, your account shall be blocked."
spam,"*Its a MONGOLIAN NIGHT at College inn located in Wandegeya opposite First Pharmacy. This Saturday is a grand launch of the Mongolian night, we have different types of meat at only 30K a plate. We also have drinks, Accommodation, pizza, cool music etc. Thank you  people of God."
ham,"You have received UGX 50000 from REHEMA NAMONO, 256774769225 on 2023-03-17 19:22:50.. Reason: r.. New balance: UGX 61986.. ID: 19639410503..."
ham,You have successfully subscribed to 8Mins_5MBs_2SMS. 300 Bundle and charged 300 shs.. Thanks for using Smartphone Network.
ham,"Welcome! Please accept and save Airtel internet settings.. Dial *175# for internet packages and dial *185# select 2,opt 5 to pay OTT tax &amp; access social sites.. Please enter 1111 as the pin if requested..."
spam,"URGENT! Your Mobile No. was awarded 2 million loyality Prize. This is our final try to contact U! Call from Landline 08064019788 promo code, 150PP"
spam,Thanks for taking part in our mobile survey yesterday! You can now have 500 texts messages to use however you wish. To get texts just send TXT to 80160 T&C www.txt43.com 1.50p
ham,"Hello church. Join us for services this week; TODAY English 4pm. SUNDAY Luganda 8am, English 10am & 12pm, and Kirundi 3pm. Men; remember fellowships resumed so you are welcome to join the Mens Fellowship; Mondays & Tuesdays at 5pm."
ham,Y'ello! Seamlessly save with our smart saving option. Dial *165*5*1*1# to set up an Autosavings account and earn up to 5% interest with MTNMoKash.
